{"provenance":{"schema":"mnemoshare.deployment-contract.v3","generator":"internal/application/link/linkgen","source_fingerprint":"782fe591a79d5688d0160be14ea2dd3db2429822cfa39776a0168e6261615cef"},"fingerprint":"57c7275aee8df2c88b551911c4cfc2e96bbfda3ad86eba5112822dd058cbf7de","executables":[{"id":"api","path":"/usr/local/bin/mnemoshare-api","default_profile":"default","profiles":[{"id":"default","kind":"api","persistence":"selected","environment":["CUSTOMER_ID","ENCRYPTION_KEY","MIGRATION_DEFAULT_ADMIN_EMAIL","MIGRATION_DEFAULT_ADMIN_PASSWORD","MONGODB_URI","S3_ACCESS_KEY","S3_BUCKET","S3_ENDPOINT","S3_SECRET_KEY","WEBAUTHN_RP_ID"],"probe":{"kind":"http","path":"/health","port":8080},"liveness_probe":{},"coexistence":"application-peers"}]},{"id":"background-worker","path":"/usr/local/bin/background-worker","default_profile":"default","profiles":[{"id":"default","kind":"worker","persistence":"selected","engines":["background","kmsrotation","messaging"],"capabilities":["leader-sweep","system-ticker"],"environment":["CUSTOMER_ID","ENCRYPTION_KEY","MONGODB_URI","S3_ACCESS_KEY","S3_BUCKET","S3_ENDPOINT","S3_SECRET_KEY"],"probe":{"kind":"process","command":["sh","-c","kill -0 1"]},"liveness_probe":{},"coexistence":"application-peers"}]},{"id":"cloud-worker","path":"/usr/local/bin/cloud-worker","default_profile":"default","profiles":[{"id":"default","kind":"worker","persistence":"selected","engines":["google","messaging","microsoft"],"capabilities":["system-ticker"],"environment":["CUSTOMER_ID","ENCRYPTION_KEY","MONGODB_URI","S3_ACCESS_KEY","S3_BUCKET","S3_ENDPOINT","S3_SECRET_KEY"],"probe":{"kind":"process","command":["sh","-c","kill -0 1"]},"liveness_probe":{},"coexistence":"application-peers"}]},{"id":"emailgateway","path":"/usr/local/bin/email-gateway","profile_selector":"GATEWAY_MODE","default_profile":"gateway","profiles":[{"id":"gateway","selection":[{"all":[{"name":"GATEWAY_MODE","operator":"equals","value":"gateway"}]}],"kind":"api","persistence":"none","environment":["ENCRYPTION_KEY","HEALTH_PORT","LISTEN_PORTS","MONGODB_URI","RELAY_SPOOL_DIR","S3_ACCESS_KEY","S3_BUCKET","S3_ENDPOINT","S3_SECRET_KEY"],"probe":{"kind":"http","path":"/readyz","port":8080},"liveness_probe":{"kind":"http","path":"/healthz","port":8080},"coexistence":"application-peers"},{"id":"inbound-relay","selection":[{"all":[{"name":"GATEWAY_MODE","operator":"equals","value":"inbound-relay"},{"name":"RELAY_SPOOL_SHARED_KEY","operator":"set"}]},{"all":[{"name":"GATEWAY_MODE","operator":"equals","value":"inbound-relay"},{"name":"RELAY_ADMIN_KEY","operator":"set"}]}],"kind":"worker","persistence":"none","environment":["ENCRYPTION_KEY","HEALTH_PORT","LISTEN_PORTS","MONGODB_URI","RELAY_SPOOL_DIR","S3_ACCESS_KEY","S3_BUCKET","S3_ENDPOINT","S3_SECRET_KEY"],"probe":{"kind":"http","path":"/readyz","port":8080},"liveness_probe":{"kind":"http","path":"/healthz","port":8080},"coexistence":"application-peers","durable_resources":[{"id":"relay-spool","kind":"filesystem","path":"/var/spool/mnemo-relay","path_environment":"RELAY_SPOOL_DIR","lifecycle":"process"}]},{"id":"relay-no-store","selection":[{"all":[{"name":"GATEWAY_MODE","operator":"equals","value":"relay"},{"name":"RELAY_DB_URI","operator":"unset"},{"name":"RELAY_ADMIN_KEY","operator":"unset"},{"name":"RELAY_SMTP_AUTH_REQUIRED","operator":"unset"},{"name":"RELAY_SPOOL_SHARED_KEY","operator":"set"}]},{"all":[{"name":"GATEWAY_MODE","operator":"equals","value":"relay"},{"name":"RELAY_DB_URI","operator":"unset"},{"name":"RELAY_ADMIN_KEY","operator":"unset"},{"name":"RELAY_SMTP_AUTH_REQUIRED","operator":"equals","value":"false"},{"name":"RELAY_SPOOL_SHARED_KEY","operator":"set"}]},{"all":[{"name":"GATEWAY_MODE","operator":"equals","value":"relay"},{"name":"RELAY_DB_URI","operator":"unset"},{"name":"RELAY_ADMIN_KEY","operator":"unset"},{"name":"RELAY_SMTP_AUTH_REQUIRED","operator":"equals","value":"0"},{"name":"RELAY_SPOOL_SHARED_KEY","operator":"set"}]}],"kind":"worker","persistence":"none","environment":["ENCRYPTION_KEY","HEALTH_PORT","LISTEN_PORTS","MONGODB_URI","RELAY_SPOOL_DIR","S3_ACCESS_KEY","S3_BUCKET","S3_ENDPOINT","S3_SECRET_KEY"],"probe":{"kind":"http","path":"/readyz","port":8080},"liveness_probe":{"kind":"http","path":"/healthz","port":8080},"coexistence":"application-peers","durable_resources":[{"id":"relay-spool","kind":"filesystem","path":"/var/spool/mnemo-relay","path_environment":"RELAY_SPOOL_DIR","lifecycle":"process"}]},{"id":"relay-dkim","selection":[{"all":[{"name":"GATEWAY_MODE","operator":"equals","value":"relay"},{"name":"RELAY_DB_URI","operator":"set"},{"name":"RELAY_ADMIN_KEY","operator":"unset"},{"name":"RELAY_SMTP_AUTH_REQUIRED","operator":"unset"},{"name":"RELAY_SPOOL_SHARED_KEY","operator":"set"}]},{"all":[{"name":"GATEWAY_MODE","operator":"equals","value":"relay"},{"name":"RELAY_DB_URI","operator":"set"},{"name":"RELAY_ADMIN_KEY","operator":"unset"},{"name":"RELAY_SMTP_AUTH_REQUIRED","operator":"equals","value":"false"},{"name":"RELAY_SPOOL_SHARED_KEY","operator":"set"}]},{"all":[{"name":"GATEWAY_MODE","operator":"equals","value":"relay"},{"name":"RELAY_DB_URI","operator":"set"},{"name":"RELAY_ADMIN_KEY","operator":"unset"},{"name":"RELAY_SMTP_AUTH_REQUIRED","operator":"equals","value":"0"},{"name":"RELAY_SPOOL_SHARED_KEY","operator":"set"}]}],"kind":"worker","persistence":"none","environment":["ENCRYPTION_KEY","HEALTH_PORT","LISTEN_PORTS","MONGODB_URI","RELAY_SPOOL_DIR","S3_ACCESS_KEY","S3_BUCKET","S3_ENDPOINT","S3_SECRET_KEY"],"probe":{"kind":"http","path":"/readyz","port":8080},"liveness_probe":{"kind":"http","path":"/healthz","port":8080},"coexistence":"application-peers","external_universes":[{"id":"email-relay-mongo","carrier":"mongodb","environment":["RELAY_DB_NAME","RELAY_DB_URI"],"surfaces":["email.dkim_keys"]}],"durable_resources":[{"id":"relay-spool","kind":"filesystem","path":"/var/spool/mnemo-relay","path_environment":"RELAY_SPOOL_DIR","lifecycle":"process"}]},{"id":"relay-dkim-and-tokens","selection":[{"all":[{"name":"GATEWAY_MODE","operator":"equals","value":"relay"},{"name":"RELAY_DB_URI","operator":"set"},{"name":"RELAY_ADMIN_KEY","operator":"set"}]},{"all":[{"name":"GATEWAY_MODE","operator":"equals","value":"relay"},{"name":"RELAY_DB_URI","operator":"set"},{"name":"RELAY_ADMIN_KEY","operator":"unset"},{"name":"RELAY_SMTP_AUTH_REQUIRED","operator":"equals","value":"true"},{"name":"RELAY_SPOOL_SHARED_KEY","operator":"set"}]},{"all":[{"name":"GATEWAY_MODE","operator":"equals","value":"relay"},{"name":"RELAY_DB_URI","operator":"set"},{"name":"RELAY_ADMIN_KEY","operator":"unset"},{"name":"RELAY_SMTP_AUTH_REQUIRED","operator":"equals","value":"1"},{"name":"RELAY_SPOOL_SHARED_KEY","operator":"set"}]}],"kind":"worker","persistence":"none","environment":["ENCRYPTION_KEY","HEALTH_PORT","LISTEN_PORTS","MONGODB_URI","RELAY_SPOOL_DIR","S3_ACCESS_KEY","S3_BUCKET","S3_ENDPOINT","S3_SECRET_KEY"],"probe":{"kind":"http","path":"/readyz","port":8080},"liveness_probe":{"kind":"http","path":"/healthz","port":8080},"coexistence":"application-peers","external_universes":[{"id":"email-relay-mongo","carrier":"mongodb","environment":["RELAY_DB_NAME","RELAY_DB_URI"],"surfaces":["egress.relay_tokens","email.dkim_keys"]}],"durable_resources":[{"id":"relay-spool","kind":"filesystem","path":"/var/spool/mnemo-relay","path_environment":"RELAY_SPOOL_DIR","lifecycle":"process"}]}]},{"id":"inboundgateway","path":"/usr/local/bin/inbound-gateway","default_profile":"default","profiles":[{"id":"default","kind":"worker","persistence":"selected","environment":["CONTENT_FILTER_PORT","CUSTOMER_ID","DELIVERY_WORKERS","ENCRYPTION_KEY","MONGODB_URI","PROCESSING_WORKERS","S3_ACCESS_KEY","S3_BUCKET","S3_ENDPOINT","S3_SECRET_KEY","SOCKETMAP_PORT"],"probe":{"kind":"http","path":"/healthz","port":8080},"liveness_probe":{},"coexistence":"application-peers"}]},{"id":"mcp-admin","path":"/usr/local/bin/mcp-admin","default_profile":"default","profiles":[{"id":"default","args":["--transport=http","--http-addr=:9222","--log-level=info","--log-format=json"],"kind":"api","persistence":"none","environment":["ENCRYPTION_KEY","MNEMOSHARE_MCP_KEY","MONGODB_URI","S3_ACCESS_KEY","S3_BUCKET","S3_ENDPOINT","S3_SECRET_KEY"],"probe":{"kind":"http","path":"/health","port":9222},"liveness_probe":{},"coexistence":"application-peers"}]},{"id":"migrate-dek-rewrap","path":"/usr/local/bin/migrate-dek-rewrap","default_profile":"default","profiles":[{"id":"default","kind":"worker","persistence":"selected","environment":["ENCRYPTION_KEY","MONGODB_URI","S3_ACCESS_KEY","S3_BUCKET","S3_ENDPOINT","S3_SECRET_KEY"],"probe":{"kind":"process","command":["true"]},"liveness_probe":{},"coexistence":"application-peers"}]},{"id":"migrate-dek-rewrap-context","path":"/usr/local/bin/migrate-dek-rewrap-context","default_profile":"default","profiles":[{"id":"default","kind":"worker","persistence":"selected","environment":["ENCRYPTION_KEY","MONGODB_URI","S3_ACCESS_KEY","S3_BUCKET","S3_ENDPOINT","S3_SECRET_KEY"],"probe":{"kind":"process","command":["true"]},"liveness_probe":{},"coexistence":"application-peers"}]},{"id":"mnemocli","path":"/usr/local/bin/mnemocli","default_profile":"default","profiles":[{"id":"default","kind":"api","persistence":"none","environment":["ENCRYPTION_KEY","MONGODB_URI","S3_ACCESS_KEY","S3_BUCKET","S3_ENDPOINT","S3_SECRET_KEY"],"probe":{"kind":"process","command":["true"]},"liveness_probe":{},"coexistence":"application-peers"}]},{"id":"repair-audit-chain","path":"/usr/local/bin/repair-audit-chain","default_profile":"default","profiles":[{"id":"default","kind":"worker","persistence":"selected","environment":["ENCRYPTION_KEY","MIGRATION_DEFAULT_ADMIN_EMAIL","MIGRATION_DEFAULT_ADMIN_PASSWORD","MONGODB_URI","S3_ACCESS_KEY","S3_BUCKET","S3_ENDPOINT","S3_SECRET_KEY","WEBAUTHN_RP_ID"],"probe":{"kind":"process","command":["true"]},"liveness_probe":{},"coexistence":"application-peers"}]},{"id":"sftp-gateway","path":"/usr/local/bin/sftp-gateway","default_profile":"default","profiles":[{"id":"default","kind":"api","persistence":"none",